{"$schema":"https://json-schema.org/draft/2020-12/schema","$id":"urn:forgecrm:ai-control:conversation:v1","type":"object","additionalProperties":false,"required":["source_id","source_version","lead_ref","timezone","messages"],"properties":{"source_id":{"type":"string","minLength":1,"maxLength":128},"source_version":{"type":"integer","minimum":1},"lead_ref":{"type":"string","minLength":1,"maxLength":128},"timezone":{"type":"string","minLength":1},"messages":{"type":"array","minItems":1,"maxItems":200,"items":{"type":"object","additionalProperties":false,"required":["message_id","author_role","occurred_at","text"],"properties":{"message_id":{"type":"string","minLength":1,"maxLength":128},"author_role":{"enum":["manager","candidate","unknown"]},"occurred_at":{"type":"string","format":"date-time"},"text":{"type":"string","maxLength":8000}}}}}}
